{
  "meta": {
    "schemaVersion": "1.0.0",
    "schema": "./source-annotations.schema.json",
    "task": "L3 — source-explorer annotation layer (Phase 2)",
    "generatedAt": "2026-08-25T00:00:00Z",
    "generatedBy": "scripts/build-source-annotations.mjs",
    "upstreamCommit": "401730514cefed738710d22303e84b0dcd6b76d0",
    "upstreamRepo": "https://github.com/dorianborian/sesame-robot.git",
    "upstreamPin": "firmware/upstream.pin.json",
    "pathsRelativeTo": "the upstream repository root. \"firmware/sesame-firmware-main.ino\" resolves to firmware/upstream/firmware/sesame-firmware-main.ino in this repo, at meta.upstreamCommit.",
    "filesAnnotated": [
      {
        "file": "firmware/sesame-firmware-main.ino",
        "lines": 1137,
        "sha256": "24a00b44091c686e1a6803028ce3108c95bcf8cc738061ebdb249fe4add96982"
      },
      {
        "file": "firmware/movement-sequences.h",
        "lines": 429,
        "sha256": "f77d713703e361dff2458f4fd02356ed397b8f47d83bd7a87587e8f6e899d2f1"
      },
      {
        "file": "firmware/face-bitmaps.h",
        "lines": 3158,
        "sha256": "722692894402d9eccf5c022ed7b4eb090c2de6b171b7872cedce55609dac1f06"
      },
      {
        "file": "firmware/captive-portal.h",
        "lines": 1015,
        "sha256": "f28273df29c4f38cce3005604f883ad161f920ae25168b1a62aa986886a5e8a4"
      }
    ],
    "epistemicContract": "Every symbol, concept and teaching note resolves to file:line inside the pinned tree, and carries the exact source text of its first and last line so a validator can re-read and compare. `description` states what the code does and is checkable against the cited lines. Judgements live in `commentary` and are labelled as such. Facts that belong to a LIBRARY rather than to Sesame source carry a `libraryEvidence` object (library + version + path-within-library + line), deliberately not shaped like a firmware citation, because the library tree is gitignored.",
    "noHardwareClaims": "Per docs/plan.md, \"Standing constraint — no physical hardware, ever\": this project will never run on a physical robot. No annotation in this file asserts that a servo moved, a joint rotated, or a pulse was observed at a pin — only what the code commands. Any lesson built on this file must read the same way.",
    "relationshipToHardwareMap": "hardware/hardware-map.json (F4) owns the ENTITIES: pins, per-movement choreography, the route table, boot order, and the face registry. This file owns the READING SURFACE: which span of source a learner is looking at, what it does, which concepts it teaches, and where it is surprising. Entities are referenced by key through `crossRefs`; nothing in hardware-map.json is restated here. Movement symbol line ranges are located independently by anchor and then asserted equal to hardware-map.json's, so the two artifacts fail loudly if they ever disagree.",
    "gateF": "Gate F: every lesson claiming \"this is how Sesame actually works\" must point to a pinned firmware symbol or source location; if it cannot, it must be labelled conceptual rather than factual. `curriculum[].grounding` is the machine-checkable form of that rule, and `curriculum[].conceptualReason` says why each ungrounded module cannot be grounded.",
    "consumers": [
      "Phase 2 source explorer UI (four synchronized panes: source ↔ architecture node ↔ robot part ↔ runtime event)",
      "Phase 2 lesson authoring — curriculum[].grounding gates factual claims",
      "Interactive architecture graph — concepts[] and crossRefs supply the node/edge vocabulary"
    ]
  },
  "coverage": {
    "note": "Computed by scripts/build-source-annotations.mjs from the resolved symbol table. \"annotatedLines\" counts lines inside at least one symbol range, so nested regions (the two dispatchers inside loop()) are counted once.",
    "files": {
      "firmware/sesame-firmware-main.ino": {
        "totalLines": 1137,
        "annotatedLines": 1038,
        "annotatedPct": 91.3
      },
      "firmware/movement-sequences.h": {
        "totalLines": 429,
        "annotatedLines": 397,
        "annotatedPct": 92.5
      },
      "firmware/face-bitmaps.h": {
        "totalLines": 3158,
        "annotatedLines": 3141,
        "annotatedPct": 99.5
      },
      "firmware/captive-portal.h": {
        "totalLines": 1015,
        "annotatedLines": 1007,
        "annotatedPct": 99.2
      }
    },
    "symbols": {
      "total": 90,
      "byKind": {
        "config": 6,
        "data": 2,
        "entrypoint": 2,
        "handler": 10,
        "helper": 25,
        "macro": 4,
        "movement-function": 4,
        "pose-function": 15,
        "region": 6,
        "state": 9,
        "table": 3,
        "type": 4
      }
    },
    "teachingSurface": {
      "movementFunctions": {
        "annotated": 19,
        "inHardwareMap": 19
      },
      "httpRoutes": {
        "annotated": 10,
        "inHardwareMap": 10
      },
      "bootSteps": {
        "referenced": 20,
        "inHardwareMap": 20
      },
      "commandVocabulary": {
        "referenced": 19,
        "inHardwareMap": 19
      },
      "faceRegistry": {
        "referencedByName": 18,
        "inHardwareMap": 38,
        "note": "Faces are annotated as a registry and a pipeline (FACE_LIST, faceEntries, setFace, updateAnimatedFace), not one symbol per face. Per-face frame data stays in hardware-map.json."
      }
    },
    "concepts": {
      "total": 39,
      "verbatimFromReport": 9,
      "withoutSymbols": [
        "emulator"
      ]
    },
    "teachingNotes": {
      "total": 17,
      "byKind": {
        "defect": 2,
        "design": 1,
        "surprise": 14
      }
    },
    "curriculum": {
      "modules": 19,
      "factual": 12,
      "conceptual": 7,
      "conceptualModules": [
        "inside-the-brain",
        "build-a-leg-pose",
        "build-a-movement",
        "real-versus-virtual",
        "what-an-emulator-is",
        "inside-renode",
        "build-your-own-experiment"
      ]
    }
  },
  "concepts": [
    {
      "id": "esp32",
      "label": "ESP32",
      "verbatimFromReport": true,
      "levels": {
        "beginner12": "Sesame's small computer/brain",
        "beginnerProgrammer": "runs `setup()` and `loop()`",
        "architecture": "Xtensa SoC + memory/peripherals"
      },
      "primaryAnchor": {
        "symbol": "setup",
        "file": "firmware/sesame-firmware-main.ino",
        "line": 651,
        "text": "void setup() {"
      },
      "symbols": [
        "ino-includes",
        "ino-prototypes",
        "setup",
        "loop"
      ],
      "teachingNotes": [],
      "lessons": [
        "meet-sesame",
        "inside-the-brain",
        "what-an-emulator-is"
      ]
    },
    {
      "id": "firmware",
      "label": "firmware",
      "verbatimFromReport": true,
      "levels": {
        "beginner12": "instructions that live on the robot",
        "beginnerProgrammer": "C++/Arduino program",
        "architecture": "application atop Arduino-ESP32/ESP-IDF"
      },
      "primaryAnchor": {
        "symbol": "ino-includes",
        "file": "firmware/sesame-firmware-main.ino",
        "line": 1,
        "text": "#include <WiFi.h>"
      },
      "symbols": [
        "movement-externs",
        "ino-includes",
        "ino-prototypes"
      ],
      "teachingNotes": [],
      "lessons": [
        "read-the-firmware"
      ]
    },
    {
      "id": "servo",
      "label": "servo",
      "verbatimFromReport": true,
      "levels": {
        "beginner12": "a joint you can command to an angle",
        "beginnerProgrammer": "`setServoAngle(R1, 135)`",
        "architecture": "PWM via ESP32Servo/LEDC"
      },
      "primaryAnchor": {
        "symbol": "setServoAngle",
        "file": "firmware/sesame-firmware-main.ino",
        "line": 1051,
        "text": "void setServoAngle(uint8_t channel, int angle) {"
      },
      "symbols": [
        "ServoName",
        "ServoNames",
        "servoNameToIndex",
        "runRestPose",
        "runStandPose",
        "runWavePose",
        "runDancePose",
        "runSwimPose",
        "runPointPose",
        "runPushupPose",
        "runBowPose",
        "runCutePose",
        "runFreakyPose",
        "runWormPose",
        "runShakePose",
        "runShrugPose",
        "runDeadPose",
        "runCrabPose",
        "runWalkPose",
        "runWalkBackward",
        "runTurnLeft",
        "runTurnRight",
        "servos-array",
        "servo-pin-table",
        "servoSubtrim",
        "handleCommandWeb",
        "setup",
        "serial-cli",
        "setServoAngle"
      ],
      "teachingNotes": [
        "TN-003",
        "TN-006",
        "TN-007",
        "TN-015"
      ],
      "lessons": [
        "meet-sesame",
        "command-one-joint",
        "how-pwm-asks",
        "build-a-leg-pose"
      ]
    },
    {
      "id": "pwm",
      "label": "PWM",
      "verbatimFromReport": true,
      "levels": {
        "beginner12": "repeated pulses that encode a requested position",
        "beginnerProgrammer": "pulse width corresponds to target",
        "architecture": "timer/LEDC/GPIO waveform"
      },
      "primaryAnchor": {
        "symbol": "setup",
        "file": "firmware/sesame-firmware-main.ino",
        "line": 651,
        "text": "void setup() {"
      },
      "symbols": [
        "servos-array",
        "setup",
        "setServoAngle"
      ],
      "teachingNotes": [
        "TN-006",
        "TN-007"
      ],
      "lessons": [
        "how-pwm-asks"
      ]
    },
    {
      "id": "i2c",
      "label": "I²C",
      "verbatimFromReport": true,
      "levels": {
        "beginner12": "two-wire conversation with the display",
        "beginnerProgrammer": "address + bytes",
        "architecture": "controller transaction to SSD1306"
      },
      "primaryAnchor": {
        "symbol": "i2c-pin-defines",
        "file": "firmware/sesame-firmware-main.ino",
        "line": 30,